{
  "schema_version": "runtime_execution.schema.v1",
  "run_id": "runtime_ef30ea4b-420f-4cbd-b7d3-7d30420759eb",
  "run_type": "real_runtime",
  "execution_context": "instrumented_local_run",
  "scenario_name": "运动相机 deterministic local artifact-check runtime",
  "run_status": "needs_revision",
  "started_at": "2026-07-20T14:32:24.339Z",
  "ended_at": "2026-07-20T14:32:24.353Z",
  "duration_ms": 12,
  "timing_status": "measured",
  "nodes": [
    {
      "node_id": "brief_parser",
      "node_name": "Brief Parser",
      "node_type": "agent",
      "sequence": 1,
      "execution_group": "serial",
      "status": "pass",
      "started_at": "2026-07-20T14:32:24.340Z",
      "ended_at": "2026-07-20T14:32:24.343Z",
      "duration_ms": 2,
      "timing_status": "measured",
      "input_refs": [
        {
          "file_path": "data/sample_brief.json"
        },
        {
          "file_path": "schemas/product_brief.schema.json"
        }
      ],
      "output_refs": [
        {
          "file_path": "outputs/standardized_brief_summary.json"
        },
        {
          "file_path": "outputs/brief_parser_report.md"
        }
      ],
      "retry_count": 0,
      "retry_count_status": "measured",
      "model_usage": {
        "usage_status": "not_used",
        "provider": null,
        "model": null,
        "prompt_tokens": null,
        "completion_tokens": null,
        "total_tokens": null,
        "estimated_cost": null,
        "currency": null
      },
      "tool_calls": [],
      "error": {
        "error_code": null,
        "error_message": null
      },
      "risk_ids": [],
      "claim_ids": []
    },
    {
      "node_id": "compliance_pre",
      "node_name": "Compliance Pre",
      "node_type": "governance",
      "sequence": 2,
      "execution_group": "serial",
      "status": "pass",
      "started_at": "2026-07-20T14:32:24.343Z",
      "ended_at": "2026-07-20T14:32:24.344Z",
      "duration_ms": 1,
      "timing_status": "measured",
      "input_refs": [
        {
          "file_path": "outputs/standardized_brief_summary.json"
        },
        {
          "file_path": "data/sample_brief.json"
        }
      ],
      "output_refs": [
        {
          "file_path": "outputs/brand_compliance_pre_check.json"
        },
        {
          "file_path": "outputs/brand_compliance_pre_check.md"
        }
      ],
      "retry_count": 0,
      "retry_count_status": "measured",
      "model_usage": {
        "usage_status": "not_used",
        "provider": null,
        "model": null,
        "prompt_tokens": null,
        "completion_tokens": null,
        "total_tokens": null,
        "estimated_cost": null,
        "currency": null
      },
      "tool_calls": [],
      "error": {
        "error_code": null,
        "error_message": null
      },
      "risk_ids": [],
      "claim_ids": []
    },
    {
      "node_id": "planner",
      "node_name": "Planner",
      "node_type": "agent",
      "sequence": 3,
      "execution_group": "serial",
      "status": "pass",
      "started_at": "2026-07-20T14:32:24.344Z",
      "ended_at": "2026-07-20T14:32:24.345Z",
      "duration_ms": 1,
      "timing_status": "measured",
      "input_refs": [
        {
          "file_path": "outputs/standardized_brief_summary.json"
        },
        {
          "file_path": "outputs/brand_compliance_pre_check.json"
        },
        {
          "file_path": "workflow/agent_workflow.md"
        }
      ],
      "output_refs": [
        {
          "file_path": "outputs/planner_execution_plan.json"
        },
        {
          "file_path": "outputs/planner_execution_plan.md"
        }
      ],
      "retry_count": 0,
      "retry_count_status": "measured",
      "model_usage": {
        "usage_status": "not_used",
        "provider": null,
        "model": null,
        "prompt_tokens": null,
        "completion_tokens": null,
        "total_tokens": null,
        "estimated_cost": null,
        "currency": null
      },
      "tool_calls": [],
      "error": {
        "error_code": null,
        "error_message": null
      },
      "risk_ids": [],
      "claim_ids": []
    },
    {
      "node_id": "audience_insight",
      "node_name": "Audience Insight",
      "node_type": "skill",
      "sequence": 4,
      "execution_group": "insight_skills_parallel_group",
      "status": "pass",
      "started_at": "2026-07-20T14:32:24.345Z",
      "ended_at": "2026-07-20T14:32:24.347Z",
      "duration_ms": 1,
      "timing_status": "measured",
      "input_refs": [
        {
          "file_path": "outputs/standardized_brief_summary.json"
        },
        {
          "file_path": "outputs/planner_execution_plan.json"
        }
      ],
      "output_refs": [
        {
          "file_path": "outputs/audience_insight.json"
        },
        {
          "file_path": "outputs/audience_insight_report.md"
        }
      ],
      "retry_count": 0,
      "retry_count_status": "measured",
      "model_usage": {
        "usage_status": "not_used",
        "provider": null,
        "model": null,
        "prompt_tokens": null,
        "completion_tokens": null,
        "total_tokens": null,
        "estimated_cost": null,
        "currency": null
      },
      "tool_calls": [],
      "error": {
        "error_code": null,
        "error_message": null
      },
      "risk_ids": [],
      "claim_ids": []
    },
    {
      "node_id": "selling_point_analyst",
      "node_name": "Selling Point Analyst",
      "node_type": "skill",
      "sequence": 4,
      "execution_group": "insight_skills_parallel_group",
      "status": "pass",
      "started_at": "2026-07-20T14:32:24.345Z",
      "ended_at": "2026-07-20T14:32:24.347Z",
      "duration_ms": 2,
      "timing_status": "measured",
      "input_refs": [
        {
          "file_path": "outputs/standardized_brief_summary.json"
        },
        {
          "file_path": "outputs/planner_execution_plan.json"
        },
        {
          "file_path": "outputs/audience_insight.json"
        }
      ],
      "output_refs": [
        {
          "file_path": "outputs/selling_point_matrix.json"
        },
        {
          "file_path": "outputs/selling_point_matrix.md"
        }
      ],
      "retry_count": 0,
      "retry_count_status": "measured",
      "model_usage": {
        "usage_status": "not_used",
        "provider": null,
        "model": null,
        "prompt_tokens": null,
        "completion_tokens": null,
        "total_tokens": null,
        "estimated_cost": null,
        "currency": null
      },
      "tool_calls": [],
      "error": {
        "error_code": null,
        "error_message": null
      },
      "risk_ids": [],
      "claim_ids": []
    },
    {
      "node_id": "platform_strategy",
      "node_name": "Platform Strategy",
      "node_type": "skill",
      "sequence": 4,
      "execution_group": "insight_skills_parallel_group",
      "status": "pass",
      "started_at": "2026-07-20T14:32:24.345Z",
      "ended_at": "2026-07-20T14:32:24.347Z",
      "duration_ms": 2,
      "timing_status": "measured",
      "input_refs": [
        {
          "file_path": "outputs/standardized_brief_summary.json"
        },
        {
          "file_path": "outputs/planner_execution_plan.json"
        }
      ],
      "output_refs": [
        {
          "file_path": "outputs/platform_strategy_plan.json"
        },
        {
          "file_path": "outputs/platform_strategy_plan.md"
        }
      ],
      "retry_count": 0,
      "retry_count_status": "measured",
      "model_usage": {
        "usage_status": "not_used",
        "provider": null,
        "model": null,
        "prompt_tokens": null,
        "completion_tokens": null,
        "total_tokens": null,
        "estimated_cost": null,
        "currency": null
      },
      "tool_calls": [],
      "error": {
        "error_code": null,
        "error_message": null
      },
      "risk_ids": [],
      "claim_ids": []
    },
    {
      "node_id": "creative_agent",
      "node_name": "Creative Agent",
      "node_type": "agent",
      "sequence": 5,
      "execution_group": "serial",
      "status": "pass",
      "started_at": "2026-07-20T14:32:24.347Z",
      "ended_at": "2026-07-20T14:32:24.348Z",
      "duration_ms": 1,
      "timing_status": "measured",
      "input_refs": [
        {
          "file_path": "outputs/audience_insight.json"
        },
        {
          "file_path": "outputs/selling_point_matrix.json"
        },
        {
          "file_path": "outputs/platform_strategy_plan.json"
        }
      ],
      "output_refs": [
        {
          "file_path": "outputs/creative_copy_pack_outline.json"
        },
        {
          "file_path": "outputs/creative_copy_pack_outline.md"
        }
      ],
      "retry_count": 0,
      "retry_count_status": "measured",
      "model_usage": {
        "usage_status": "not_used",
        "provider": null,
        "model": null,
        "prompt_tokens": null,
        "completion_tokens": null,
        "total_tokens": null,
        "estimated_cost": null,
        "currency": null
      },
      "tool_calls": [],
      "error": {
        "error_code": null,
        "error_message": null
      },
      "risk_ids": [],
      "claim_ids": []
    },
    {
      "node_id": "image_prompt_skill",
      "node_name": "Image Prompt Skill",
      "node_type": "skill",
      "sequence": 6,
      "execution_group": "serial",
      "status": "pass",
      "started_at": "2026-07-20T14:32:24.348Z",
      "ended_at": "2026-07-20T14:32:24.349Z",
      "duration_ms": 1,
      "timing_status": "measured",
      "input_refs": [
        {
          "file_path": "outputs/creative_copy_pack_outline.json"
        },
        {
          "file_path": "outputs/selling_point_matrix.json"
        },
        {
          "file_path": "outputs/platform_strategy_plan.json"
        }
      ],
      "output_refs": [
        {